{
  "payloadType": "application/vnd.act.event+json",
  "payload": {
    "protocol_version": "act/1.0",
    "event_type": "genesis",
    "occurred_at": "2026-07-16T00:00:00Z",
    "actor": {
      "actor_id": "018f5b1a-0000-7000-8000-000000000010",
      "key_id": "ed25519:aaaaaaaaaaaaaaaa"
    },
    "tenant": "act-protocol",
    "subject": { "kind": "artifact", "artifact_id": "018f5b1a-0000-7000-8000-000000000011" },
    "causal_parents": [],
    "content_descriptors": [],
    "policy_context": { "not_applicable": true, "reason": "genesis event predates any policy" },
    "payload": {},
    "extensions": {}
  },
  "payloadDigest": "sha-256:1111111111111111111111111111111111111111111111111111111111111111",
  "signatures": [
    {
      "key_id": "ed25519:aaaaaaaaaaaaaaaa",
      "algorithm": "ed25519",
      "signature": "ZmFrZS1zaWduYXR1cmU="
    }
  ]
}
